category,title,tags,description
онлайн-лекции,Занятия по стрельбе из лука и арбалета в клубе «Лабиринт»,"['Стрельба', 'Лук', 'Арбалет', 'Тренировки', 'Спорт', 'Тренеры', 'Мишень', 'Индивидуальные тренировки', 'Клуб', 'Дети']","Максимальная концентрация на цели, напряжение пальцев, стремительный полёт стрелы — и вот вы попадаете в яблочко! Как обращаться с одним из старейших видов оружия, вам расскажут и покажут опытные тренеры клуба «Лабиринт». Наслаждайтесь практической стрельбой на удобной площадке. Для продвинутых стрелков, которые уже знакомы не понаслышке с луком и арбалетом, и новичков, мечтающих взять в руки легендарное оружие эльфов и разбойников Шервудского леса, клуб «Лабиринт» проводит увлекательные занятия в группах до 5 человек. Используйте своё оружие или берите в аренду — стоимость часа занятий с тренером в группе из 5 человек составляет 1800 и 2500 рублей соответственно. Аренда дорожки и самостоятельное занятие с личным оружием обойдётся в 1000 рублей за час. Хотите заниматься индивидуально с тренером? Нет проблем! Стоимость персональной часовой тренировки составит 7500 рублей. Под руководством инструкторов — профессиональных спортсменов — вы можете узнать всё об устройстве лука и арбалета, научиться правильно стоять и держать оружие, целиться и метко попадать в мишень. Юных спортсменов старше 10 лет в клубе «Лабиринт» также приглашают вступить в «клуб единомышленников». Девочкам и мальчикам младше сложно справляться с нагрузкой при натягивании тетивы, но если ребёнок силён и физически подготовлен, тренеры иногда делают исключения."
онлайн-лекции,Котельническая. Лекция в сталинской высотке с видом на Кремль,"['Лекция', 'Советские небоскрёбы', 'Столичные постройки', 'История', 'Экскурсия', 'Дом', 'Котельническая набережная', 'Высотка', 'Лектор', 'Виды', 'Россия']","Изучите выдающуюся постройку на Котельнической набережной буквально изнутри, посетив лекцию в квартире знаменитого советского небоскрёба. Лекция о выдающейся постройке столицы — это хорошо, а беседа о ней в самом здании — ещё лучше! Гостям расскажут об истории и жильцах одного из самых известных советских небоскрёбов — сталинской высотке на Котельнической набережной. Почувствовать дух здания можно только посетив его. Поэтому лекцию прочтут в одной из квартир высотки с великолепным видом на Кремль. Слушатели не только узнают о необычных деталях уникального дома, но и увидят их воочию. Лектор в увлекательной форме расскажет множество интересных фактов о сталинских высотках и поделится информацией, которую не услышишь на экскурсиях. Вы узнаете, как девять лауреатов спали в одной кровати, почему точно неизвестно, сколько квартир в доме, и как высотка влияла на жизнь современной России. Беседа состоится в духе дружеской встречи — в домашней обстановке, за чашечкой чая с угощениями, а лекционным залом на вечер станет уютная гостиная. Лекции проводятся в особенном месте — в маленьком лектории прямо под звездой высотки, откуда открываются одни из лучших видов в городе."
онлайн-лекции,Лекция «Сальвадор Дали: фобии и взгляд извне» на выставке «Сальвадор Дали & Пабло Пикассо»,"['Сальвадор Дали', 'Искусство', 'Искусствоведение', 'Маэстро', 'Художник', 'Творчество', 'Мистика', 'Биография', 'Скульптура', 'Лекция', 'Сюрреализм', 'История', 'Идеи', 'Мировоззрение']","Слушатели познакомятся с мировоззрением великого испанского художника, узнают интересные факты из биографии маэстро и смогут лучше понять его творчество. Работы Сальвадора Дали отличаются многообразием мистических образов, насыщенными цветами и трудноуловимыми смыслами. В окружении подлинной скульптуры знаменитого художника гости прослушают лекцию, посвящённую таинственным аспектам жизни мастера. Искусствовед Ольга Бурмистрова познакомит слушателей с историей становления прославленного живописца, его страхами и безумными идеями. Слушатели узнают, какими странными чертами характера обладал Дали и с чем связаны его попытки сбежать в собственный сюрреалистичный мир."
онлайн-лекции,Вебинар «Как за 1 месяц овладеть профессией „Тестировщик ПО“»,"['Тестировщик', 'IT-сфера', 'Карьера', 'Вебинар', 'Трудоустройство', 'Профессия', 'Требования', 'Зарплата', 'Тестирование ПО', 'Карьерные возможности', 'Опыт', 'Программирование']","Участники бесплатного вебинара познакомятся с профессией тестировщика и узнают, как быстро влиться в IT-сферу и получить конкурентноспособную зарплату уже на начальных этапах новой карьеры. Подумываете сменить сферу деятельности, но боитесь потерять стабильный доход и не знаете, с чего начать? На бесплатном вебинаре подробно расскажут о престижной и интересной профессии, а также дадут советы по трудоустройству. Вебинар проведёт руководитель отдела тестирования. Слушатели узнают: каким требованиям должен соответствовать начинающий тестировщик ПО; что такое тестирование и какие виды тестирования существуют; как начинающему тестировщику выйти на зарплату от 40000 до 90000 рублей в месяц; какие карьерные возможности и перспективы ждут выбравших эту сферу деятельности; как устроиться на работу без опыта. На практической части занятия слушатели смогут протестировать свою первую программу."
музыка и танцы,Мумий Тролль Music Bar,"['Бар', 'Ресторан', 'Музыка', 'Интерьер', 'Кухня', 'Морепродукты', 'Коктейли', 'Дизайн', 'Праздники', 'Банкеты', 'Дни рождения', 'Девичники', 'Музыканты', 'Архитектура']","Бар от группы «Мумий Тролль» на Новом Арбате. Ресторан и бар встречает гостей живой музыкой, тихоокеанской кухней и необычным интерьером. Наш ресторан отлично подойдет для новых знакомств и ярких впечатлений, ведь на сцене бар «Мумий Тролль Music Bar» выступили более 500 исполнителей. Команда ресторана следит за высоким качеством звука. На профессиональной сцене каждый день выступают музыканты из Азиатско-Тихоокеанского региона. Здесь же проходят отборочные туры фестиваля V-ROX и партнерских международных событий в музыкальной сфере. На кухне ресторана «Мумий Тролль Мьюзик Бар» мы готовим свежую рыбу и морепродукты, а за баром объединили мировые гастрономические традиции. В аквариумах обитают живые устрицы, на горячее делаем 7 вариантов пасты с крабом, трубачом и креветками. В хоспере и на гриле запекаем рыбу и мясо: жарим щупальца осьминога, стейки и дальневосточных гребешков.По утрам встречаем на ранних завтраках. В специальном меню собрали блюда из яиц с морепродуктами, круассаны и блины с различными начинками. По будням с действует меню приморских ланчей. В баре «Мумий Тролль Мьюзик бар» миксуют порядка 10 авторских коктейлей и около 30 привычных вариантов вроде Mai Tai. В барной карте представили сет-шоты и внушительную коллекцию крепкого алкоголя, среди которого значится корейский соджу и японский виски. Еще есть на кранах и в бутылках китайское пиво. Дизайн-проект ресторана разработали архитекторы из бюро Archpoint. В интерьере они переплели творческую историю легендарной группы и морские мотивы. К примеру, пол стилизовали под палубу, а окна сделали в виде иллюминаторов. Часть стен оформили под транспортные контейнеры и украсили их работами современных художников. В баре на Новом Арбате любят отмечать шумные праздники, банкеты, дни рождения и девичники. У нас оборудовали сцену и танцпол, а еще можно арендовать профессиональный свет и звук. По запросу организуем развлекательную программу, чтобы вечер прошел весело и интересно."
музыка и танцы,Powerhouse Moscow,"['Клуб', 'Бар', 'Ресторан', 'Лейбл', 'Звукозаписывающая студия', 'Особняк XIX века', 'Афиша', 'Концерты', 'Вечеринки', 'Спектакли', 'Кинопоказы', 'Маркеты', 'Летняя терраса', 'Газон', 'Шезлонги', 'Меню', 'Дневное меню', 'Вечернее меню', 'Шотландские блюда', 'Барная карта', 'Виски', 'Классические коктейли']","Клуб, бар, ресторан, лейбл и звукозаписывающая студия в особняке XIX века. Насыщенная и интересная афиша: концерты, вечеринки, спектакли, кинопоказы, маркеты (летом часть мероприятий проходит прямо в уютном внутреннем дворике, где работает летняя терраса с газоном и шезлонгами). Меню разделено на две части: дневное, рассчитанное на офисных сотрудников, и вечернее, с более интересными и сложными блюдами; среди специалитетов – несколько малоизвестных в России шотландских блюд. В барной карте акцент сделан на виски и классические коктейли."
музыка и танцы,Bambule,"['Винный бар', 'Коктейльный бар', 'Вечеринки', 'Солянка', 'Двухэтажное пространство', 'Европейский стиль', 'Петербургский стиль', 'Высокие потолки', 'Полукруглые ниши', 'Оконные арки', 'Старинный интерьер', 'Стены в стиле оштукатуренные', 'Паркетный пол', 'Мебель 70-х годов', 'Вино', 'Винная карта', 'Коктейли на основе вина', 'Легкие закуски', 'Тапас', 'Пинчос', 'Горячие европейские блюда', 'Музыка', 'Bambule', 'Танцы']","Винный и коктейльный бар с вечеринками на Солянке. Двухэтажное пространство напоминает европейское или петербургского бара: высокие потолки, полукруглые ниши и оконные арки, оштукатуренные и слегка облупившиеся стены, паркетный пол, мебель в стиле 70-х годов. Вино представлено двумя десятками наименований, на бутылки наклеили специальные картинки для удобного запоминания. На основе вина делают и некоторые коктейли. Из еды можно выбрать легкие закуски вроде тапас и пинчос или поесть более плотно, выбрав горячие европейские блюда. Каждый день в баре играет музыка, а в выходные проходят Bambule превращается в шумное место с танцами."
музыка и танцы,Наука и искусство,"['Ночной клуб', 'Арт-площадка', 'Неформальный', 'Наставнический переулок', 'Маленький зал', 'Вечеринки', 'Диджеи', 'Лекции', 'Показы кинофильмов', 'Выставки', 'Интеллектуальные игры', 'Современная музыка', 'Техно', 'Альтернатива', 'Инди-рок', 'Электроника', 'Поп-композиции', 'Летний фудкорт', 'Сэндвичи', 'Кофе', 'Барная карта', 'Классические напитки', 'Коктейли']","Неформальный ночной-клуб и арт-площадка в Наставническом переулке. В «Науке и искусстве» небольшой зал практически без посадочных мест, в котором проходят и вечеринки с диджеями из разных стран мира, и лекции, и показы кинофильмов, и выставки, и интеллектуальные игры. Из музыки на вечеринки ставят современные техно, альтернативу, инди-рок, электронику, поп-композиции. Меню в клубе нет, только летом можно перекусить на фудкорте сэндвичами и кофе; в барной карте — классические напитки и коктейли."
музыка и танцы,Noor,"['Бар', 'Авторские коктейли', 'Вечеринки', 'Тверская улица', 'Респектабельный', 'Аутентичный', 'Стильный', 'Модернистский', 'Электротеатр Станиславского', 'Миксология', 'Карта коктейлей', 'Бармены', 'Марат Саддаров', 'Flavoured Martinis', 'Retro Cocktails', 'Liquid Celebrities', 'Гранатовый тини', 'Джин', 'Барные закуски', 'Брускетты', 'Тартар из говядины', 'Картофельные чипсы', 'Вьетнамские блинчики', 'Сэндвичи', 'Супы', 'Паста', 'Стейк', 'Пельмени', 'Пирог', 'Ланч', 'Ланч-меню', 'Пицца', 'Вино', 'Джазовые трибьюты', 'Соцсети']","Noor — знаменитый бар с авторскими коктейлями и красивыми вечеринками на Тверской улице.Noor можно описать в трех словах: респектабельный, аутентичный, стильный. Бар работает по соседству с модернистским «Электротеатром Станиславского». Поэтому сюда часто заглядывают видные москвичи и те, кто сделали себе имя в искусстве и кино.Бар Noor работает с 2009 года. Он до сих пор получает премии за миксологию и карту. За нее отвечает бессменная команда барменов под началом одного из лучших российских бартендеров Марата Саддарова. Коктейли в карте разделены по стилям: Flavoured Martinis, Retro Cocktails, Liquid Celebrities... К каждому в меню дана небольшая аннотация, чтобы помочь с выбором. Фирменным в баре «Нур» на Тверской считается гранатовый тини на основе джина.К напиткам готовят много легких барных закусок, среди них мини-брускетты с вяленой ветчиной, классический тартар из говядины, который подают с картофельными чипсами, и вьетнамские блинчики нем коны с креветками и авокадо. Из того, что посерьезней подают сэндвичи, несколько супов, пасту, стейк, пельмени и пирог. С 12:00 до 17:00 можно заглянуть на обед. Два блюда обойдутся не более 500 рублей, три — 600 рублей. Вдобавок в ланч-меню есть сеты: пицца дня с колой, паста с бокалом вина и три сухих мартини.В 2014 году бар Noor пережил реконструкцию и увеличился в размерах. Лейтмотивом интерьера стал чикагский арт-деко. Внутри — желтые стены, бирюзовый потолок, пианино, барная стойка из белой плитки, люстры из стекла и металла, обилие фацетированных зеркал и латуни.В баре Noor часто устраивают джазовые трибьюты и вечеринки, где модные диджеи ставят свою любимую музыку. За анонсами можно следить в соцсетях."
музыка и танцы,Стрелка,"['Бар', 'Вечеринки', 'Видовая терраса', 'Институт', 'Эклектичный интерьер', 'Ар-деко', 'Итальянский дизайн', 'Скандинавский дизайн', 'Терраса', 'Москва-река', 'Патриарший мост', 'Храм Христа Спасителя', 'Диджеи', 'Вино', 'Коктейли', 'Фруктовые лонг-дринки', 'Джин', 'Бурбон', 'Тики-коктейли', 'Сауэры', 'Strelka Lemonade', 'Тапас', 'Горячие блюда', 'Салаты', 'Десерты', 'Вегетарианская кухня', 'Завтраки', 'Омлеты', 'Сырники', 'Круассаны', 'Панкейки']","«Стрелка» — бар с вечеринками и видовой террасой при одноименном институте.Интерьер бара оформлен эклектично, с элементами ар-деко, итальянского и скандинавского дизайна 60-х и 70-х годов. В теплое время года на крыше открывается просторная терраса. Сюда приходят ради непринужденного общения за бокалом вина или коктейлем и фото на фоне Москвы-реки, Патриаршего моста и храма Христа Спасителя. По выходным в «Стрелке» проходят традиционные вечеринки с диджеями.Винная карта насчитывает более полусотни наименований из Италии, Франции, Испании и Португалии. Авторских коктейлей около ста на выбор: фруктовые лонг-дринки, крепкие напитки на основе джина и бурбона, тропические тики-коктейли, сауэры с выраженной кислотностью. В списке сразу несколько фирменных, один из них Strelka Lemonade с фруктовой водкой, грейпфрутом, мараскино и лаймом.К напиткам предлагают тапас-меню с небольшими закусками, которые удобно есть руками. Но действует и достаточно объемное предложение с интернациональными горячими блюдами, салатами и десертами. Среди них много вегетарианских позиций. Каждый день подают завтраки с омлетами, сырниками, круассанами, панкейками и другими утренними блюдами."
