category,title,tags,description
здоровье,Соревнования по плаванию в физкультурно-оздоровительном комплексе «Касатка»,"['Физкультурно-оздоровительный комплекс', 'Состязания', 'Плавание', 'День народного единства', 'Спортивные секции', 'Возрастные категории', 'Дистанции', 'Победители', 'Призеры', 'Кубки', 'Медали', 'Призы', 'Показательные выступления', 'Мастер-классы', 'Развлекательная программа']","В физкультурно-оздоровительном комплексе «Касатка» пройдут состязания по плаванию, посвященные Дню народного единства. В них примут участие воспитанники спортивных секций ГБУ ЦФКиС ВАО в возрасте от семи до 16 лет. Они будут соревноваться на разных дистанциях. Победители и призеры получат кубки, медали и призы.В рамках состязаний пройдут показательные выступления спортсменов, мастер-классы и развлекательная программа."
здоровье,Фестиваль ГТО в спортивно-оздоровительном комплексе «Новое поколение — Вешняки»,"['Район Вешняки', 'Нормативы', 'ГТО', 'Спортивный фестиваль', 'Бег', 'Дистанции', 'Наклоны', 'Прыжки в длину', 'Подтягивание', 'Сгибание и разгибание рук', 'Семейный спортивно-оздоровительный комплекс', 'Стадион', 'Школа № 402', 'Регистрация', 'Личный идентификационный номер']","Жители района Вешняки смогут сдать нормативы комплекса ГТО на июльском спортивном фестивале. Среди них бег на различные дистанции (от 30 метров до трех километров), наклоны вперед из положения стоя, прыжки в длину с разбега, подтягивание на перекладине, сгибание и разгибание рук. Фестиваль пройдет на территории семейного спортивно-оздоровительного комплекса «Новое поколение — Вешняки» и стадионе школы № 402. Для того чтобы сдать спортивные нормы, необходимо зарегистрироваться и получить личный идентификационный номер."
здоровье,Оздоровительные занятия в Измайловском парке,"['Измайловский парк', 'Оздоровительные занятия', 'Бломберг', 'Нервно-мышечная релаксация', 'Дыхательные упражнения', 'Танцевальная разминка', 'Упражнения на ковриках', 'Ремни для йоги', 'Теннисные мячи', 'Мастер-класс', 'Спортивный инвентарь', 'Противопоказания']","Измайловский парк приглашает гостей на оздоровительные занятия. Комплекс включает ритмичные движения Бломберга, нервно-мышечную релаксацию по Джекобсону, дыхательные упражнения, а также упражнения для снятия напряжения в мышцах и суставах.Занятия проведет инструктор Олег Щекин. Участники начнут с танцевальной разминки, а затем сделают упражнения на ковриках с использованием ремней для йоги и теннисных мячей.Присоединиться к мастер-классу смогут жители в возрасте от 20 до 55 лет. Спортивный инвентарь рекомендуется принести с собой.Противопоказания: воспалительные процессы, послеоперационный период, травмы позвоночника."
здоровье,Оздоровительный интенсив «Дыхание солнца» в ЦКиД «Академический»,"['Дыхательно-оздоровительная китайская гимнастика', 'Цигун', 'Упражнения', 'Обучение', 'Интенсивы', 'Школа цигун', 'Специалисты', 'Многие лета']","В программе: обучение основам дыхательно-оздровительной китайской гимнастики цигун, изучение начальных комплексов упражнений. Интенсивы проводят специалисты школы цигун «Многие лета»."
здоровье,Занятие по оздоровительной гимнастике в ТЦСО «Отрадное»,"['Оздоровительная гимнастика', 'Наталья Евгеньевна Вахромеева', 'Суставы', 'Пожилой возраст', 'Занятие', 'Музыкальное сопровождение', 'Физические способности', 'Состояние организма']","10 октября в 11:20 в филиале «Отрадное» ГБУ ТЦСО «Бабушкинский» для жителей района состоится занятие по оздоровительной гимнастике по методу Натальи Евгеньевны Вахромеевой. Гимнастика направлена на улучшение работы суставов тела, без нагрузки на сердечно-сосудистую систему, и проходит под музыкальное сопровождение. Упражнения разработаны специально для людей пожилого возраста, с учетом их физических способностей и состояния организма в целом."
Спорт,Динамо М — Факел,"['Спорт', 'Футбол', '0+']","Матч столетия великого клуба.

В этот день в нашем доме в центре Москвы соберутся все настоящие динамовцы и бело-голубая семья. Споём гимн клуба вместе с ветеранами, игроками, воспитанниками Академии и болельщиками. Вспомним всю историю «Динамо» и все эпохи команды, о которых мы рассказывали в течение всего сезона. Вновь наденем родные цвета и будем болеть за литеру «Д», которую с гордостью носим на груди и передаём из поколения в поколение. Насладимся ярким световым шоу и разыграем множество уникальных подарков на этом особенном матче.

Динамовцы, ждём вас на нашем общем празднике — юбилее любимого клуба.

Отметим столетие вместе."
Спорт,Финал Лиги Чемпионов УЕФА 2022,"['Лига Чемпионов', 'финал', 'УЕФА']","Финальный матч Лиги Чемпионов УЕФА 2022 года, где встретились две лучшие клубные команды Европы в борьбе за звание чемпиона."
Спорт,Классико: 'Барселона' против 'Реал Мадрид',"['классико', 'Барселона', 'Реал Мадрид']","Историческое соперничество между 'Барселоной' и 'Реал Мадрид', где две испанские футбольные гиганты встречаются в эмоциональном противостоянии."
Спорт,Финал Кубка мира 2018: Франция против Хорватии,"['Чемпионат мира', 'финал', 'Франция', 'Хорватия']","Финальный матч чемпионата мира по футболу 2018 года, где сборные Франции и Хорватии сразились за главный трофей."
Спорт,Дерби Манчестера: 'Манчестер Юнайтед' против 'Манчестер Сити',"['дерби', 'Манчестер', 'Манчестер Юнайтед', 'Манчестер Сити']","Эмоциональное противостояние двух манчестерских команд, 'Манчестер Юнайтед' и 'Манчестер Сити', в одном из самых горячих дерби в Английской Премьер-лиге."
Спорт,Суперкубок Италии 2023: 'Ювентус' против 'Милан',"['Суперкубок', 'Италия', 'Ювентус', 'Милан']","Матч за Суперкубок Италии 2023 между двумя итальянскими титанами, 'Ювентусом' и 'Миланом'."
Спорт,Сборная Бразилии против Сборной Аргентины,"['сборные', 'Бразилия', 'Аргентина']","Захватывающий матч между сборными Бразилии и Аргентины, включающий в себя выдающихся футболистов и традиционное соперничество между двумя южноамериканскими командами."
Спорт,'Ливерпуль' против 'Манчестер Сити' в Английской Премьер-лиге,"['Английская Премьер-лига', 'Ливерпуль', 'Манчестер Сити']","Значимый матч в Английской Премьер-лиге между 'Ливерпулем' и 'Манчестер Сити', двумя сильными клубами из Англии."
Спорт,'Бавария' против 'Боруссии Дортмунд' в Бундеслиге,"['Бундеслига', 'Бавария', 'Боруссия Дортмунд']","Значимый матч в немецкой Бундеслиге между 'Баварией' и 'Боруссией Дортмунд', двумя традиционными соперниками."
Спорт,'Атлетико Мадрид' против 'Барселоны' в Ла Лиге,"['Ла Лига', 'Атлетико Мадрид', 'Барселона']",Заслуживающий внимания матч в испанской Ла Лиге между 'Атлетико Мадрид' и 'Барселоной'.
Спорт,'Пари Сен-Жермен' против 'Марселя' в Лиге 1,"['Лига 1', 'Пари Сен-Жермен', 'Марсель']",Значимая игра во французской Лиге 1 между 'Пари Сен-Жермен' и 'Марселем'.
Спорт,Финал НБА 2022,"['НБА', 'финал', 'баскетбол']","Финальная серия Национальной баскетбольной ассоциации (НБА) 2022 года, где встретились две лучшие команды в борьбе за чемпионство."
Спорт,Дерби Лос-Анджелеса: 'Лос-Анджелес Лейкерс' против 'Лос-Анджелес Клипперс',"['дерби', 'Лос-Анджелес', 'Лейкерс', 'Клипперс', 'баскетбол']","Эмоциональное противостояние двух баскетбольных команд из Лос-Анджелеса, 'Лос-Анджелес Лейкерс' и 'Лос-Анджелес Клипперс'."
Спорт,Матч всех звёзд НБА 2023,"['НБА', 'звёзды', 'баскетбол']","Ежегодное мероприятие Национальной баскетбольной ассоциации, где встречаются лучшие игроки лиги в одной игре."
Спорт,Финал Кубка NCAA 2023,"['NCAA', 'финал', 'баскетбол']","Финальный матч в чемпионате Национальной ассоциации студенческих атлетов (NCAA) 2023 года, где студенческие команды борются за титул чемпиона."
Спорт,Олимпийские игры в баскетболе 2024,"['Олимпийские игры', 'баскетбол']","Баскетбольное соревнование на летних Олимпийских играх 2024 года, где команды из разных стран соревнуются за золотые медали."
Спорт,Финал Евролиги 2023,"['Евролига', 'финал', 'баскетбол']","Финальная игра в Евролиге 2023 года, в которой встретятся лучшие клубные баскетбольные команды Европы."
Спорт,Матч 'Голден Стэйт Уорриорз' против 'Лос-Анджелес Лейкерс',"['Голден Стэйт Уорриорз', 'Лос-Анджелес Лейкерс', 'баскетбол']","Встреча двух известных команд НБА, 'Голден Стэйт Уорриорз' и 'Лос-Анджелес Лейкерс'."
Спорт,Матч за третье место на Олимпийских играх 2024 в баскетболе,"['Олимпийские игры', 'баскетбол']",Соревнование за бронзовую медаль в баскетболе на летних Олимпийских играх 2024 года.
Спорт,Финал Женской НБА 2023,"['НБА', 'женский баскетбол', 'финал']","Финальный матч Женской Национальной баскетбольной ассоциации (НБА) 2023 года, где команды женского баскетбола соревнуются за титул чемпиона."
Спорт,Финал Кубка Мира FIBA 2023,"['FIBA', 'финал', 'баскетбол']","Финальный матч Кубка Мира по баскетболу FIBA 2023 года, где национальные команды борются за золото."
Спорт,Финал Кубка Стэнли 2022,"['Кубок Стэнли', 'финал', 'хоккей']","Финальная серия Национальной хоккейной лиги (НХЛ) 2022 года, где встретились две лучшие команды в борьбе за Кубок Стэнли."
Спорт,Дерби Нью-Йорка: 'Нью-Йорк Рейнджерс' против 'Нью-Йорк Айлендерс',"['дерби', 'Нью-Йорк', 'Рейнджерс', 'Айлендерс', 'хоккей']","Эмоциональное противостояние двух хоккейных команд из Нью-Йорка, 'Нью-Йорк Рейнджерс' и 'Нью-Йорк Айлендерс'."
Спорт,Матч звёзд НХЛ 2023,"['НХЛ', 'звёзды', 'хоккей']","Ежегодное мероприятие Национальной хоккейной лиги (НХЛ), где встречаются лучшие хоккеисты лиги в одной игре."
Спорт,Финал Кубка Мира по хоккею 2023,"['Кубок Мира по хоккею', 'финал', 'хоккей']","Финальный матч Кубка Мира по хоккею 2023 года, где национальные хоккейные команды соревнуются за главный трофей."
Спорт,Олимпийские игры в хоккее 2024,"['Олимпийские игры', 'хоккей']","Хоккейное соревнование на зимних Олимпийских играх 2024 года, где команды из разных стран борются за золотые медали."
Спорт,Финал КХЛ 2023,"['КХЛ', 'финал', 'хоккей']","Финальная серия Континентальной хоккейной лиги (КХЛ) 2023 года, в которой встретятся сильнейшие клубные хоккейные команды Евразии."
Спорт,Матч 'Чикаго Блэкхокс' против 'Детройт Ред Уингс',"['Чикаго Блэкхокс', 'Детройт Ред Уингс', 'хоккей']","Встреча двух известных команд НХЛ, 'Чикаго Блэкхокс' и 'Детройт Ред Уингс'."
Спорт,Матч за бронзовую медаль на Олимпийских играх 2024 в хоккее,"['Олимпийские игры', 'хоккей']",Соревнование за бронзовую медаль в хоккее на зимних Олимпийских играх 2024 года.
Спорт,Финал Женской НХЛ 2023,"['НХЛ', 'женский хоккей', 'финал']","Финальный матч Женской Национальной хоккейной лиги (НХЛ) 2023 года, где команды женского хоккея соревнуются за титул чемпиона."
Спорт,Финал Кубка Мира по хоккею с шайбой 2023,"['Кубок Мира по хоккею с шайбой', 'финал', 'хоккей']","Финальный матч Кубка Мира по хоккею с шайбой 2023 года, где национальные команды соревнуются за звание чемпиона мира."
Спорт,Гран-при Формулы 1: Германия 2022,"['Формула 1', 'гран-при', 'автоспорт']","Один из этапов чемпионата мира Формулы 1 2022 года, который проходит в Германии."
Спорт,Ралли Дакар 2023,"['Ралли Дакар', 'автоспорт']","Увлекательное соревнование в ралли-марафоне, где участники проходят экстремальные пустынные маршруты."
Спорт,24 часа Ле-Мана 2023,"['24 часа Ле-Мана', 'автоспорт']","Легендарное соревнование в автоспорте, где гонщики соревнуются 24 часа в гонке на выносливость."
Спорт,Монакский Гран-при Формулы 1 2023,"['Формула 1', 'гран-при', 'автоспорт']","Этап чемпионата мира Формулы 1 2023 года, который проходит на улицах Монако и считается одним из самых престижных гран-при."
Спорт,Париж-Дакар 2024,"['Париж-Дакар', 'автоспорт']","Известное ралли-рейд соревнование, которое охватывает разнообразные территории и трассы."
Спорт,Гонка 1000 миль Северной Европы 2023,"['автоспорт', 'гонка 1000 миль']","Долгая гоночная дистанция, пройденная через северные регионы Европы, включая разнообразные климатические условия."
Спорт,Ралли Финляндии 2023,"['Ралли Финляндии', 'автоспорт']","Соревнование в ралли, проходящее по уникальным лесным и гравийным трассам Финляндии."
Спорт,Индианаполис 500 2023,"['Индианаполис 500', 'автоспорт']","Знаменитая автогонка в США, известная своей длиной и скоростью."
Спорт,Гран-при Монцы Формулы 1 2023,"['Формула 1', 'гран-при', 'автоспорт']","Этап чемпионата мира Формулы 1 2023 года, который проходит на историческом треке Монцы в Италии."
Спорт,Британская Туринговая Карта 2023,"['Туринговая карта', 'автоспорт']","Соревнование в автоспорте, где участники соревнуются на гоночных версиях обычных автомобилей."
Прогулки,Прогулка в Александровском саду,"['Москва', 'Александровский сад', 'прогулка', 'природа']","Александровский сад - это уютный исторический сад, расположенный в центре Москвы. Прогулка в этом саду позволяет насладиться зеленью, цветами и архитектурными памятниками. Вы также сможете увидеть Александровский манеж и Кремль с его красивыми башнями."
Прогулки,Прогулка в парке Царицыно,"['Москва', 'Царицыно', 'парк', 'природа']","Парк Царицыно - это одно из самых красивых мест в Москве. Здесь вы можете прогуляться по живописным аллеям, наслаждаясь видами дворца Царицыно и его прудов. Парк также славится разнообразными растениями и цветами."
Прогулки,Вечерняя прогулка по набережной Москвы-реки,"['Москва', 'набережная', 'прогулка', 'река']","Наслаждайтесь вечерней атмосферой Москвы, гуляя по набережной Москвы-реки. Вы сможете увидеть искусственные острова, мосты и огоньки ночного города."
Прогулки,Прогулка в парке Горького,"['Москва', 'парк', 'прогулка', 'отдых']","Отдыхайте и наслаждайтесь природой в центральном парке имени Горького. Здесь есть аттракционы, озеро и множество кафе, где можно расслабиться и насладиться атмосферой парка."
Прогулки,Поход по Арбату,"['Москва', 'Арбат', 'поход', 'культура']","Исследуйте исторический Арбат, прогуливаясь среди магазинов, ресторанов и уличных художников. Арбат славится своей культурной атмосферой и уникальными магазинами."
Прогулки,Прогулка в Аптекарском огороде,"['Москва', 'Аптекарский огород', 'прогулка', 'природа']",Посетите ботанический сад Аптекарского огорода и насладитесь редкими растениями и ароматами. Это место идеально подходит для спокойной и освежающей прогулки.
Прогулки,Прогулка в Лосиноостровском заповеднике,"['Москва', 'Лосиноостровский заповедник', 'прогулка', 'природа']",Отправьтесь на природную прогулку в Лосиноостровский заповедник и насладитесь уединением с природой. Здесь можно встретить разнообразные виды животных и птиц.
Прогулки,Прогулка по мостам Москвы,"['Москва', 'мосты', 'прогулка', 'архитектура']","Путешествие по московским мостам, наслаждаясь видами и архитектурой города. Вы сможете увидеть разные стили и архитектурные решения мостов, пересекающих Москва-реку."
