category,title,tags,description
выставка,«Выставка «Метафоры и Цветы»,"['Выставка', 'Мысли', 'Рассуждения', 'Глобальные вопросы', 'Философия', 'Метафоры', 'Социум', 'Личность', 'Индивидуальность', 'Социальное взаимодействие', 'Цветовая палитра', 'Синий', 'Зеленый', 'Красный', 'Желтый']","Выставка посвящена мыслям и рассуждениям на темы основных глобальных вопросов — нахождение своего места в мире, в круговерти городской суеты, извечной незримой гонке, в которую мы вовлечены с самого детства — «Быстрее. Выше. Сильнее». И когда мы так себе говорим, всегда находится тот, кого мы догоняем и кого мы перегоняем. И вот эти мысли на философские темы о поиске себя, о поиске стержня, о поиске работы в команде — переданы через метафоры и показаны в работах, отражают взгляды и концепции авторов. И это скорее поиск графических визуальных образов, которые передают понимание взаимодействия человека с обществом, не всегда автора, а именно Человека с обществом. Работа «Общее дело», показывает, что у каждого человека есть свой внутренний мир, со своими сложностями, со своими метаниями, уголками, со своими потемками, в которых он бродит. И вот эта какая-то особенность выраженна в цветовых сочетаниях. И когда один человек встречается со вторым человеком их индивидуальность является тем связующим звеном, через которое происходит взаимодействие, но когда они занимаются общим делом у них происходит выборочная деятельность посвященная сугубо общему делу, а вся остальная деятельность, связанная с личными переживаниями, с личной жизнью уходит на второй план, остается за кадром.Подобного плана метафоры и вопросы графически и показаны в этих работах.Метафоры на тему рассуждений о том, как личность взаимодействует с другими личностями в социуме ради какого-то единого общего дела, потому что сам по себе человек уникален, он сложен из каких-то своих жизненных ситуаций, которые делают его отличным от других людей. Но когда эта личность встречается с другими личностями ей приходится опустить свою сложность и быть более мобильной, более доступной, более коммуникабельной, более гибкой, более простой. Т.е. она не себя упрощает, а ей приходится убирать свои выпирающие, торчащие грани, чтобы быть «облым», круглым, частью чего-то большего чем свои интересы, а где есть нечто большее - там приходится поступаться своими особенностями и принимать условия игры которые приняты в социуме. Метания сознания также показаны через глубину, сочетания цветов, разнообразие оттенков одного цвета и контраст, столкновение цветов противоположных. Синий воспринимается как спокойный и сильный цвет, призванный расслаблять и приносить ощущение мира и гармонии. Бескрайнее небо, глубокий океан, прохлада и свежесть — это ассоциации, которые у человека вызывает синий. Влияет он и на эмоции: успокаивает чувства и снижает тревогу. При добавлении зеленого оттенка появляется лазурь, навевающая чувство гармонии, спокойствия, баланса и уравновешенности внутренней энергии. Но как только синий становится глубоким, приближается к черному он погружает зрителя в глубину внутреннего мира, внутренних переживаний и беспокойств. Сталкиваясь с яркими кричащими цветами, такими как красный или насыщенный желтый внимание целиком захватывается и требует усилий для восприятия, при этом настораживает и возбуждает, толкает к активным действиям, проявлению силы и страсти."
выставка,Выставка украшений от бренда AQUAMARINE,"['Выставка', 'Ювелирные украшения', 'AQUAMARINE', 'ORO', 'Premium-класс', 'Бриллианты', 'Драгоценные камни', 'Коллекции', 'Кожа ската', 'Салоны', 'Цены', 'Подбор украшений', 'Профессионалы ювелирной сферы', 'Подарки', 'Праздничное угощение', 'Беларусь', 'Накопительная программа лояльности', 'Рассрочка', 'Кредитные предложения']","Со 2 по 25 сентября в сети ювелирных салонов ORO пройдет особенное мероприятие — эксклюзивная выставка украшений от известного бренда AQUAMARINE.AQUAMARINE — крупный российский производитель, эксперт в сфере ювелирных изделий Premium-класса с бриллиантами и другими драгоценными камнями высшего качества.На выставке будут представлены классические ювелирные силуэты в сочетании с бриллиантами, яркими рубинами, сапфирами и изумрудами, которые являются основой ювелирной коллекции каждой современной женщины, а также уникальные изделия с кожей ската.На ювелирной выставке вас ждут:Презентация золотых коллекций и бриллиантовой классики;Возможность покупки украшений по специальной цене от производителя AQUAMARINE; Личная помощь в подборе украшений от профессионалов ювелирной сферы; Подарки покупателям, праздничное угощение и торжественная атмосфера для прекрасного настроения.Приходите в салоны ювелирной сети ORO на ювелирную выставку, которая пройдет:Все украшения AQUAMARINE, представленные на выставке, можно посмотреть на сайте: oro.by.Подробнее о бриллиантовых коллекциях AQUAMARINE в статье: oro.byО нас:ORO — это уникальная ювелирная сеть в Беларуси. Мы разбираемся в украшениях, мы чувствуем, что хочет наш клиент, и предугадываем, что он захочет завтра.Покупайте украшения и становитесь участником накопительной программы лояльности с первоначальной дополнительной скидкой 3%. А чтобы ваш ювелирный шоппинг был еще приятнее, воспользуйтесь собственной рассрочкой от сети ORO или кредитными предложениями банков-партнеров."
выставка,Выставка удивительных фактов и достижений,['Минск'],"В век всемогущего интернета, кажется, что уже трудно удивиться диковинками, но выставка интересных фактов и достижений «Ничосе!» докажет обратное и поразит даже скептиков.Древний детектор лжи, угадать страну по запаху. Сыграть на ханге или фруктах, посмотреть, как выглядел город, построенный специально для испытания ядерной бомбы. Увидите самых необычных людей планеты, узнаете самые странные законы на планете, а также поучаствуете в постановке рекорда Гинесса по созданию самого большого панно автопортретов в мире - эксклюзивная выставка для минчан и гостей столицы.Проект, общей площадью 500 квадратных метров, где на 35 локациях собрано порядка 100 экспонатов, которые обязательно вызовут неподдельный интерес, как у детей, так и у взрослых. Оформленные локации и множество необычных фотозон позволят наполнить интересными и яркими фотографиями ваши соцсети."
выставка,Art Store «Автопортрет. Откровение»,"['Откровение', 'Истина', 'Искренность', 'Автопортрет', 'Художники', 'Я-концепция', 'Чувства', 'Состояния', 'Современное искусство', 'Белорусское искусство', 'Зрители', 'Творчество', 'Сходство', 'Трансформация']","Слово «откровение» является производным от слова «открытый» и обозначает что-то, неожиданно раскрывающее истину, что-то неведомое до сих пор. Быть откровенным — значит быть искренним, правдивым, не утаивать своих мыслей.Автопортрет — это изображение художником самого себя.Данный проект объединяет работы 18 авторов, работающих в различных медиа, и показывает то, каким себя видит и ощущает художник. Авторы транслируют свою Я-концепцию, в которую входят их наблюдения за собой, осмысление своих чувств и состояний в настоящий момент: «Кто я? Какой я сейчас?».Мы приглашаем зрителя познакомиться с современными художниками, через их автопортреты, а также приобрести кусочек белорусского искусства в свою коллекцию. Каждый может углубиться в интимный мир творческих людей, и может быть, среди множества образов найти сходство с собой. Каждый портрет — трансформация внутреннего во внешнее."
выставка,Выставка «Леонид Щемелев – зеркало эпохи»,"['Выставка искусства', 'Леонид Щемелев', '100-летие', 'Живопись', 'Графика', 'Художник', 'Беларусь', 'Творчество', 'Патриотическая тематика', 'Пейзажи', 'Портреты', 'Натюрморты', 'Графические работы', 'Экспрессивность', 'Фотоархив', 'Искусство XX века', 'Долголетие', 'Жизненная мудрость']","4 февраля 2023 года в галерее искусств Леонида Щемелева начнет работать юбилейная выставка живописи и графики народного художника Беларуси Леонида Дмитриевича Щемелева, посвященная 100-летию со дня рождения Мастера.Все, что я воплощаю в холстах - моя жизнь.Это история моей Родины, это люди, которых бесконечно люблю, и - природа, без которой не мыслю своего существования. (Л. Щемелев)Леонид Дмитриевич Щемелев - выдающийся художник современности, который внес значительный вклад в развитие художественной культуры Беларуси. Его творческое наследие отражает важнейшие события истории страны и повседневности, поднимает серьезные гражданские и философские проблемы, побуждает к размышлению о самых важных для человека вещах: о добре и зле, о Родине и ее судьбах, о любви и радости жизни.Впервые в одном галерейном пространстве представлено 150 картин народного художника Леонида Дмитриевича Щемелева. В девяти залах Галереи искусств Леонида Щемелева можно познакомиться со знаковыми работами патриотической тематики - «Родина», «На родной ниве», «Море нарочанское», «Светолуние», «На земле Огинского», «Веснянское поле», пейзажами - «Солнечное утро», «Субботний день», «Минское море», «Огненный лен», «Ливень», портретами известных деятелей и близких людей, наполненными психологической глубиной, прекрасными натюрмортами - пышными и скромными, яркими и нежными, рассказывающими каждый свою историю. И, конечно, на выставке представлены графические работы Мастера. Все произведения Леонида Щемелева отличаются экспрессивностью и свободной пластической манерой исполнения. Посетители юбилейной экспозиции смогут также познакомиться с фотоархивом семьи, который позволит увидеть Л. Щемелева в кругу друзей и родных, «прикоснуться» к палитре народного художника.Влияние творчества Леонида Щемелева на живописную культуру Беларуси второй половины XX столетия огромно, а его жизненный путь Художника и Гражданина - это высокий пример творческого долголетия, духовной зрелости и жизненной мудрости."
выставка,Выстава «Літаратурныя партрэты Віктара Барабанцава»,"['Выставка искусства', 'Литературная выставка', 'Виктор Барабанцев', 'Живопись', 'Графика', 'Беларусь', 'Искусство XX века', 'Портреты', 'Реализм', 'Художник', 'Культурное наследие', 'Музей', '100-летие', 'Заслуженный деятель искусств', 'Национальное наследие']","8 чэрвеня 2023 года ў Дзяржаўным музеі гісторыі беларускай літаратуры адбудзецца адкрыццё часовай літаратурна-мастацкай экспазіцыі «Літаратурныя партрэты Віктара Барабанцава».Пачатак а 16-й гадзіне.Мастак Віктар Барабанцаў – адзін з нешматлікіх майстроў, які плённа працуе на ніве выяўлення беларускіх дзеячоў літаратуры, ахапляючы часовую прастору ад старажытнасці да сучаснасці.Выстава «Літаратурныя партрэты Віктара Барабанцава» дае магчымасць згадаць, а можа, i адкрыць для сябе імёны выдатных дзеячоў беларускай літаратуры і культуры: Кірылы Тураўскага, Сымона Буднага, Адама Міцкевіча, Вінцэнта Дуніна-Марцінкевіча, Станіслава Манюшкі, Уладзіслава Сыракомлі, Браніслава Эпімах-Шыпілы, Максіма Багдановіча, Аляксея Дударава, Уладзіміра Карызны, Георгія Марчука, Алены Стэльмах, Віктара Карамазава, Алеся Бадака, Віктара Шніпа і інш.Заўважна, як каларытна імкнецца мастак прадставіць сваіх герояў гледачу. Ён выступае свайго роду пасрэднікам у гэтым знаёмстве, імкнецца перадаць уласную павагу, любоў i захапленне літаратурнымі знакамітасцямі.Барабанцаў вельмі дакладна перадае не толькі знешні выгляд партрэтуемых, але i раскрывае ix характар, духоўную сутнасць. Дэвіз Віктара Барабанцава: «Найпершая задача мастака – мець уласны погляд на ўcë: на Бога, чалавека, прыроду, радзіму, а мальберты ды фарбы ва ўcix аднолькавыя. Знайдзі радзіму, адчуй яе ў сваёй душы».Імя Віктара Барабанцава – аднаго з вядучых прадстаўнікоў рэалістычнага напрамку ў сучасным беларускім жывапісе – добра ведаюць знаўцы і аматары выяўленчага мастацтва як у нашай краіне, так i за яе межамі. Віктар Кірылавіч – Заслужаны дзеяч мастацтваў Рэспублікі Беларусь (2018). Узнагароджаны медалём Беларускага саюза мастакоў «За заслугі ў выяўленчым мастацтве» (1999), медалём Францыска Скарыны (2010), нагрудным знакам Міністэрства культуры Рэспублікі Беларусь «За ўклад у развіццё культуры Беларусі» (2012). Лаўрэат прэміі прафсаюзаў Беларусі (1990), прэміі «За духоўнае адраджэнне» (2001).Творы В.К. Барабанцава захоўваюцца ў музеях Беларусі, прыватных калекцыях Бельгіі, Вялікабрытаніі, Кіпра, Нідэрландаў, Польшчы, ЗША, Швецыі. Выстава будзе дзейнічаць па 30 верасня 2023 года ."
